{
  "artifacts": {
    "artifact_dir": ".powerpacks/runs/artifacts/search-network-5ebd5dba-03ee-4c4c-ab0c-e3b92ed3d5ec",
    "created_at": "2026-07-31T05:44:07Z",
    "csv": ".powerpacks/runs/artifacts/search-network-5ebd5dba-03ee-4c4c-ab0c-e3b92ed3d5ec/search-network-5ebd5dba-03ee-4c4c-ab0c-e3b92ed3d5ec.csv",
    "frontier_count": 1,
    "hydrated_count": 1,
    "jsonl": ".powerpacks/runs/artifacts/search-network-5ebd5dba-03ee-4c4c-ab0c-e3b92ed3d5ec/search-network-5ebd5dba-03ee-4c4c-ab0c-e3b92ed3d5ec.jsonl",
    "manifest": ".powerpacks/runs/artifacts/search-network-5ebd5dba-03ee-4c4c-ab0c-e3b92ed3d5ec/search-network-5ebd5dba-03ee-4c4c-ab0c-e3b92ed3d5ec.manifest.json",
    "query": "founders",
    "row_count": 1,
    "state": ".powerpacks/runs/search-network-5ebd5dba-03ee-4c4c-ab0c-e3b92ed3d5ec-founders.json",
    "task_id": "search-network-5ebd5dba-03ee-4c4c-ab0c-e3b92ed3d5ec"
  },
  "candidate_feedback": [],
  "constraints": {
    "no_company_signal_search": true,
    "no_expensive_scoring": true,
    "no_llm_enrichment": true,
    "no_summary_search": true
  },
  "created_at": "2026-07-31T05:44:07Z",
  "criteria_mutations": [],
  "exemplar_sets": [],
  "fanout_threads": [],
  "plan": {},
  "query": "founders",
  "run_lineage": [],
  "search_plan_revisions": [],
  "status": "running",
  "steps": [
    {
      "id": "expand_search_request",
      "output": {
        "filters": {
          "role_bm25_queries": [
            "founder"
          ],
          "role_core_patterns": [
            {
              "examples": [
                "Founder"
              ],
              "regex": "founder"
            }
          ],
          "role_function": "founder",
          "role_ids": [
            {
              "display_value": "Founder",
              "id": "founder"
            }
          ]
        },
        "intent_type": "role_search",
        "normalized_query": "founders",
        "notes": [
          "Local search scope is the DuckDB file; no set_id/operator resolution is used."
        ],
        "original_query": "founders",
        "role_search_filters": {
          "bm25_queries": [
            "founder",
            "Founder"
          ],
          "local_title_clustering_status": {
            "cluster_count": 0,
            "selected_count": 0,
            "status": "completed"
          },
          "role_bm25_queries": [
            "founder"
          ],
          "role_core_patterns": [
            {
              "examples": [
                "Founder"
              ],
              "regex": "founder"
            }
          ],
          "role_function": "founder",
          "role_ids": [
            "founder"
          ]
        },
        "source_type": "prod_expand_query",
        "vertical": "people"
      },
      "recorded_at": "2026-07-31T05:44:07Z",
      "status": "completed"
    },
    {
      "elapsed_ms": 0,
      "id": "apply_prefilters",
      "output": {
        "base_candidate_count": 0,
        "base_candidate_ids": [],
        "company_union_candidate_count": 0,
        "company_union_candidate_ids": [],
        "company_union_candidates": [],
        "namespaces": {
          "education": "local_people_education",
          "people": "local_people_positions",
          "summaries": "local_summaries"
        },
        "ran_prefilters": false,
        "role_prefilter_ran": false,
        "search_mode": "SEARCH_ONLY",
        "stages": [],
        "truncated": false
      },
      "recorded_at": "2026-07-31T05:44:07Z",
      "status": "completed"
    },
    {
      "elapsed_ms": 42,
      "id": "execute_role_search",
      "output": {
        "agentic_sql_candidate_count": 0,
        "agentic_sql_tagged": 0,
        "applied_filter": [
          "role_ids",
          "ContainsAny",
          [
            "founder"
          ]
        ],
        "base_id_batch_count": null,
        "base_id_batch_size": null,
        "batched_base_ids": false,
        "candidate_ids": [
          "00000000-0000-0000-0000-000000000008"
        ],
        "candidates": [
          {
            "city": "Palo Alto",
            "company_id": "linkedin:company:founder",
            "company_name": null,
            "country": "United States",
            "is_current": true,
            "macro_region": null,
            "matched_position_ids": [
              "00000000-0000-0000-0000-000000000008-1"
            ],
            "metro_areas": [
              "San Francisco Bay Area"
            ],
            "person_id": "00000000-0000-0000-0000-000000000008",
            "position_id": "00000000-0000-0000-0000-000000000008-1",
            "position_title": "Founder",
            "role_track": "general",
            "score": 0.05081967213114755,
            "seniority_band": "c_suite",
            "state": "California",
            "vertical_sources": [
              "hybrid",
              "summary"
            ]
          }
        ],
        "company_union_added": 0,
        "company_union_candidate_count": 0,
        "limit": 0,
        "namespace": "local_people_positions",
        "prefilter_short_circuit": false,
        "retrieval_artifact": ".powerpacks/runs/artifacts/search-network-5ebd5dba-03ee-4c4c-ab0c-e3b92ed3d5ec/retrieval.json",
        "retrieval_mode": "hybrid",
        "returned_people": 1,
        "search_mode": "SEARCH_ONLY",
        "top_k": 50,
        "vertical_source_counts": {
          "hybrid": 1,
          "summary": 1
        },
        "verticals": {
          "company_signal": {
            "namespace_row_count": 1,
            "row_count": 0,
            "status": "completed"
          },
          "role": {
            "row_count": 1,
            "status": "completed"
          },
          "summary": {
            "row_count": 1,
            "status": "completed"
          }
        }
      },
      "recorded_at": "2026-07-31T05:44:07Z",
      "status": "completed"
    },
    {
      "elapsed_ms": 30,
      "id": "hydrate_people",
      "output": {
        "artifacts": {},
        "hydrated": 1,
        "llm_profiles_path": ".powerpacks/runs/artifacts/search-network-5ebd5dba-03ee-4c4c-ab0c-e3b92ed3d5ec/hydrate_people/llm_profiles.jsonl",
        "profile_ids": [
          "00000000-0000-0000-0000-000000000008"
        ],
        "profiles_compressed": true,
        "profiles_path": ".powerpacks/runs/artifacts/search-network-5ebd5dba-03ee-4c4c-ab0c-e3b92ed3d5ec/hydrate_people/profiles.jsonl.gz",
        "requested": 1,
        "source": {
          "backend": "duckdb",
          "batch_size": 1000,
          "duckdb": "/private/var/folders/vv/13z9d0dj3hzg0m4dl6nq_7jm0000gn/T/tmpmbr73m_0/local-search.duckdb",
          "type": "local_duckdb",
          "workers": 8
        }
      },
      "recorded_at": "2026-07-31T05:44:07Z",
      "status": "completed"
    }
  ],
  "task": "search_network",
  "task_id": "search-network-5ebd5dba-03ee-4c4c-ab0c-e3b92ed3d5ec",
  "updated_at": "2026-07-31T05:44:07Z"
}
